[
  {
    "name": "acid blast",
    "type": "spell",
    "function": "acid_blast",
    "target": "victim",
    "mana_cost": 20,
    "lag": 12,
    "cooldown": 0,
    "failure_rate": 0.0,
    "messages": {
      "damage": "acid blast",
      "wear_off": "!Acid Blast!"
    }
  },
  {
    "name": "armor",
    "type": "spell",
    "function": "armor",
    "target": "friendly",
    "mana_cost": 5,
    "lag": 12,
    "cooldown": 0,
    "failure_rate": 0.0,
    "messages": {
      "damage": "",
      "wear_off": "You feel less armored."
    }
  },
  {
    "name": "bless",
    "type": "spell",
    "function": "bless",
    "target": "defensive_character_or_object",
    "mana_cost": 5,
    "lag": 12,
    "cooldown": 0,
    "failure_rate": 0.0,
    "messages": {
      "damage": "",
      "wear_off": "You feel less righteous.",
      "object": "$p's holy aura fades."
    }
  },
  {
    "name": "blindness",
    "type": "spell",
    "function": "blindness",
    "target": "victim",
    "mana_cost": 5,
    "lag": 12,
    "cooldown": 0,
    "failure_rate": 0.0,
    "messages": {
      "damage": "",
      "wear_off": "You can see again."
    }
  },
  {
    "name": "burning hands",
    "type": "spell",
    "function": "burning_hands",
    "target": "victim",
    "mana_cost": 15,
    "lag": 12,
    "cooldown": 0,
    "failure_rate": 0.0,
    "messages": {
      "damage": "burning hands",
      "wear_off": "!Burning Hands!"
    }
  },
  {
    "name": "call lightning",
    "type": "spell",
    "function": "call_lightning",
    "target": "ignore",
    "mana_cost": 15,
    "lag": 12,
    "cooldown": 0,
    "failure_rate": 0.0,
    "messages": {
      "damage": "lightning bolt",
      "wear_off": "!Call Lightning!"
    }
  },
  {
    "name": "calm",
    "type": "spell",
    "function": "calm",
    "target": "ignore",
    "mana_cost": 30,
    "lag": 12,
    "cooldown": 0,
    "failure_rate": 0.0,
    "messages": {
      "damage": "",
      "wear_off": "You have lost your peace of mind."
    }
  },
  {
    "name": "cancellation",
    "type": "spell",
    "function": "cancellation",
    "target": "victim",
    "mana_cost": 20,
    "lag": 12,
    "cooldown": 0,
    "failure_rate": 0.0,
    "messages": {
      "damage": "",
      "wear_off": "!Cancellation!"
    }
  },
  {
    "name": "cause critical",
    "type": "spell",
    "function": "cause_critical",
    "target": "victim",
    "mana_cost": 20,
    "lag": 12,
    "cooldown": 0,
    "failure_rate": 0.0,
    "messages": {
      "damage": "spell",
      "wear_off": "!Cause Critical!"
    }
  },
  {
    "name": "cause light",
    "type": "spell",
    "function": "cause_light",
    "target": "victim",
    "mana_cost": 15,
    "lag": 12,
    "cooldown": 0,
    "failure_rate": 0.0,
    "messages": {
      "damage": "spell",
      "wear_off": "!Cause Light!"
    }
  },
  {
    "name": "cause serious",
    "type": "spell",
    "function": "cause_serious",
    "target": "victim",
    "mana_cost": 17,
    "lag": 12,
    "cooldown": 0,
    "failure_rate": 0.0,
    "messages": {
      "damage": "spell",
      "wear_off": "!Cause Serious!"
    }
  },
  {
    "name": "chain lightning",
    "type": "spell",
    "function": "chain_lightning",
    "target": "victim",
    "mana_cost": 25,
    "lag": 12,
    "cooldown": 0,
    "failure_rate": 0.0,
    "messages": {
      "damage": "lightning",
      "wear_off": "!Chain Lightning!"
    }
  },
  {
    "name": "change sex",
    "type": "spell",
    "function": "change_sex",
    "target": "friendly",
    "mana_cost": 15,
    "lag": 12,
    "cooldown": 0,
    "failure_rate": 0.0,
    "messages": {
      "damage": "",
      "wear_off": "Your body feels familiar again."
    }
  },
  {
    "name": "charm person",
    "type": "spell",
    "function": "charm_person",
    "target": "victim",
    "mana_cost": 5,
    "lag": 12,
    "cooldown": 0,
    "failure_rate": 0.0,
    "messages": {
      "damage": "",
      "wear_off": "You feel more self-confident."
    }
  },
  {
    "name": "chill touch",
    "type": "spell",
    "function": "chill_touch",
    "target": "victim",
    "mana_cost": 15,
    "lag": 12,
    "cooldown": 0,
    "failure_rate": 0.0,
    "messages": {
      "damage": "chilling touch",
      "wear_off": "You feel less cold."
    }
  },
  {
    "name": "colour spray",
    "type": "spell",
    "function": "colour_spray",
    "target": "victim",
    "mana_cost": 15,
    "lag": 12,
    "cooldown": 0,
    "failure_rate": 0.0,
    "messages": {
      "damage": "colour spray",
      "wear_off": "!Colour Spray!"
    }
  },
  {
    "name": "continual light",
    "type": "spell",
    "function": "continual_light",
    "target": "ignore",
    "mana_cost": 7,
    "lag": 12,
    "cooldown": 0,
    "failure_rate": 0.0,
    "messages": {
      "damage": "",
      "wear_off": "!Continual Light!"
    }
  },
  {
    "name": "control weather",
    "type": "spell",
    "function": "control_weather",
    "target": "ignore",
    "mana_cost": 25,
    "lag": 12,
    "cooldown": 0,
    "failure_rate": 0.0,
    "messages": {
      "damage": "",
      "wear_off": "!Control Weather!"
    }
  },
  {
    "name": "create food",
    "type": "spell",
    "function": "create_food",
    "target": "ignore",
    "mana_cost": 5,
    "lag": 12,
    "cooldown": 0,
    "failure_rate": 0.0,
    "messages": {
      "damage": "",
      "wear_off": "!Create Food!"
    }
  },
  {
    "name": "create rose",
    "type": "spell",
    "function": "create_rose",
    "target": "ignore",
    "mana_cost": 30,
    "lag": 12,
    "cooldown": 0,
    "failure_rate": 0.0,
    "messages": {
      "damage": "",
      "wear_off": "!Create Rose!"
    }
  },
  {
    "name": "create spring",
    "type": "spell",
    "function": "create_spring",
    "target": "ignore",
    "mana_cost": 20,
    "lag": 12,
    "cooldown": 0,
    "failure_rate": 0.0,
    "messages": {
      "damage": "",
      "wear_off": "!Create Spring!"
    }
  },
  {
    "name": "create water",
    "type": "spell",
    "function": "create_water",
    "target": "object",
    "mana_cost": 5,
    "lag": 12,
    "cooldown": 0,
    "failure_rate": 0.0,
    "messages": {
      "damage": "",
      "wear_off": "!Create Water!"
    }
  },
  {
    "name": "cure blindness",
    "type": "spell",
    "function": "cure_blindness",
    "target": "friendly",
    "mana_cost": 5,
    "lag": 12,
    "cooldown": 0,
    "failure_rate": 0.0,
    "messages": {
      "damage": "",
      "wear_off": "!Cure Blindness!"
    }
  },
  {
    "name": "cure critical",
    "type": "spell",
    "function": "cure_critical",
    "target": "friendly",
    "mana_cost": 20,
    "lag": 12,
    "cooldown": 0,
    "failure_rate": 0.0,
    "messages": {
      "damage": "",
      "wear_off": "!Cure Critical!"
    }
  },
  {
    "name": "cure disease",
    "type": "spell",
    "function": "cure_disease",
    "target": "friendly",
    "mana_cost": 20,
    "lag": 12,
    "cooldown": 0,
    "failure_rate": 0.0,
    "messages": {
      "damage": "",
      "wear_off": "!Cure Disease!"
    }
  },
  {
    "name": "cure light",
    "type": "spell",
    "function": "cure_light",
    "target": "friendly",
    "mana_cost": 10,
    "lag": 12,
    "cooldown": 0,
    "failure_rate": 0.0,
    "messages": {
      "damage": "",
      "wear_off": "!Cure Light!"
    }
  },
  {
    "name": "cure poison",
    "type": "spell",
    "function": "cure_poison",
    "target": "friendly",
    "mana_cost": 5,
    "lag": 12,
    "cooldown": 0,
    "failure_rate": 0.0,
    "messages": {
      "damage": "",
      "wear_off": "!Cure Poison!"
    }
  },
  {
    "name": "cure serious",
    "type": "spell",
    "function": "cure_serious",
    "target": "friendly",
    "mana_cost": 15,
    "lag": 12,
    "cooldown": 0,
    "failure_rate": 0.0,
    "messages": {
      "damage": "",
      "wear_off": "!Cure Serious!"
    }
  },
  {
    "name": "curse",
    "type": "spell",
    "function": "curse",
    "target": "offensive_character_or_object",
    "mana_cost": 20,
    "lag": 12,
    "cooldown": 0,
    "failure_rate": 0.0,
    "messages": {
      "damage": "curse",
      "wear_off": "The curse wears off.",
      "object": "$p is no longer impure."
    }
  },
  {
    "name": "demonfire",
    "type": "spell",
    "function": "demonfire",
    "target": "victim",
    "mana_cost": 20,
    "lag": 12,
    "cooldown": 0,
    "failure_rate": 0.0,
    "messages": {
      "damage": "torments",
      "wear_off": "!Demonfire!"
    }
  },
  {
    "name": "detect evil",
    "type": "spell",
    "function": "detect_evil",
    "target": "self",
    "mana_cost": 5,
    "lag": 12,
    "cooldown": 0,
    "failure_rate": 0.0,
    "messages": {
      "damage": "",
      "wear_off": "The red in your vision disappears."
    }
  },
  {
    "name": "detect good",
    "type": "spell",
    "function": "detect_good",
    "target": "self",
    "mana_cost": 5,
    "lag": 12,
    "cooldown": 0,
    "failure_rate": 0.0,
    "messages": {
      "damage": "",
      "wear_off": "The gold in your vision disappears."
    }
  },
  {
    "name": "detect hidden",
    "type": "spell",
    "function": "detect_hidden",
    "target": "self",
    "mana_cost": 5,
    "lag": 12,
    "cooldown": 0,
    "failure_rate": 0.0,
    "messages": {
      "damage": "",
      "wear_off": "You feel less aware of your surroundings."
    }
  },
  {
    "name": "detect invis",
    "type": "spell",
    "function": "detect_invis",
    "target": "self",
    "mana_cost": 5,
    "lag": 12,
    "cooldown": 0,
    "failure_rate": 0.0,
    "messages": {
      "damage": "",
      "wear_off": "You no longer see invisible objects."
    }
  },
  {
    "name": "detect magic",
    "type": "spell",
    "function": "detect_magic",
    "target": "self",
    "mana_cost": 5,
    "lag": 12,
    "cooldown": 0,
    "failure_rate": 0.0,
    "messages": {
      "damage": "",
      "wear_off": "The detect magic wears off."
    }
  },
  {
    "name": "detect poison",
    "type": "spell",